Product name,Amazon URL,Affiliate URL,Category,Target page,Best-for label,Rating,Review count,Price range,Reason for inclusion,Risk/concern,Final recommendation
The Automatic Customer by John Warrillow,https://www.amazon.com/s?k=The+Automatic+Customer+John+Warrillow,https://www.amazon.com/s?k=The+Automatic+Customer+John+Warrillow&tag=aurarevenue-20,Books,best-saas-finance-books; saas-founder-toolkit,Founders learning subscription revenue models,Verify in Amazon Associates before publishing public claims,Verify in Amazon Associates before publishing public claims,Do not hardcode,Strong subscription business fit for recurring revenue education,Broader than SaaS,Yes
Subscribed by Tien Tzuo,https://www.amazon.com/s?k=Subscribed+Tien+Tzuo,https://www.amazon.com/s?k=Subscribed+Tien+Tzuo&tag=aurarevenue-20,Books,best-saas-finance-books,Operators studying subscription business strategy,Verify in Amazon Associates before publishing public claims,Verify in Amazon Associates before publishing public claims,Do not hardcode,Useful subscription-economy context for retention and expansion,Broad strategy rather than tactical finance,Yes
The SaaS Playbook by Rob Walling,https://www.amazon.com/s?k=The+SaaS+Playbook+Rob+Walling,https://www.amazon.com/s?k=The+SaaS+Playbook+Rob+Walling&tag=aurarevenue-20,Books,best-saas-finance-books; saas-founder-toolkit,Bootstrapped SaaS founders,Verify in Amazon Associates before publishing public claims,Verify in Amazon Associates before publishing public claims,Do not hardcode,Highly relevant to indie SaaS founders and operators,Less relevant to enterprise finance teams,Yes
Lean Analytics by Alistair Croll and Benjamin Yoskovitz,https://www.amazon.com/s?k=Lean+Analytics+Alistair+Croll+Benjamin+Yoskovitz,https://www.amazon.com/s?k=Lean+Analytics+Alistair+Croll+Benjamin+Yoskovitz&tag=aurarevenue-20,Books,best-saas-finance-books; saas-founder-toolkit,Founders choosing the right metric for their stage,Verify in Amazon Associates before publishing public claims,Verify in Amazon Associates before publishing public claims,Do not hardcode,Strong fit for metric selection and avoiding vanity metrics,Covers multiple business models,Yes
Traction by Gabriel Weinberg and Justin Mares,https://www.amazon.com/s?k=Traction+Gabriel+Weinberg+Justin+Mares,https://www.amazon.com/s?k=Traction+Gabriel+Weinberg+Justin+Mares&tag=aurarevenue-20,Books,best-saas-finance-books,Founders comparing acquisition channels,Verify in Amazon Associates before publishing public claims,Verify in Amazon Associates before publishing public claims,Do not hardcode,Connects growth assumptions to acquisition channels,Needs retention context,Yes
Monetizing Innovation by Madhavan Ramanujam and Georg Tacke,https://www.amazon.com/s?k=Monetizing+Innovation+Madhavan+Ramanujam+Georg+Tacke,https://www.amazon.com/s?k=Monetizing+Innovation+Madhavan+Ramanujam+Georg+Tacke&tag=aurarevenue-20,Books,best-saas-finance-books; saas-founder-toolkit,Founders making pricing and packaging decisions,Verify in Amazon Associates before publishing public claims,Verify in Amazon Associates before publishing public claims,Do not hardcode,Useful for pricing assumptions that affect MRR and churn,Not SaaS-only,Yes
Obviously Awesome by April Dunford,https://www.amazon.com/s?k=Obviously+Awesome+April+Dunford,https://www.amazon.com/s?k=Obviously+Awesome+April+Dunford&tag=aurarevenue-20,Books,best-saas-finance-books; saas-founder-toolkit,Founders improving positioning before scaling growth,Verify in Amazon Associates before publishing public claims,Verify in Amazon Associates before publishing public claims,Do not hardcode,Positioning affects conversion pricing and churn,Not a finance book,Yes
Financial Intelligence for Entrepreneurs by Karen Berman and Joe Knight,https://www.amazon.com/s?k=Financial+Intelligence+for+Entrepreneurs+Karen+Berman+Joe+Knight,https://www.amazon.com/s?k=Financial+Intelligence+for+Entrepreneurs+Karen+Berman+Joe+Knight&tag=aurarevenue-20,Books,best-saas-finance-books,Founders learning finance fundamentals,Verify in Amazon Associates before publishing public claims,Verify in Amazon Associates before publishing public claims,Do not hardcode,Good broad finance foundation for non-finance founders,Not SaaS-specific,Yes
Venture Deals by Brad Feld and Jason Mendelson,https://www.amazon.com/s?k=Venture+Deals+Brad+Feld+Jason+Mendelson,https://www.amazon.com/s?k=Venture+Deals+Brad+Feld+Jason+Mendelson&tag=aurarevenue-20,Books,best-saas-finance-books,Founders preparing for fundraising conversations,Verify in Amazon Associates before publishing public claims,Verify in Amazon Associates before publishing public claims,Do not hardcode,Relevant when forecasts support fundraising conversations,Less useful for fully bootstrapped founders,Yes
The Mom Test by Rob Fitzpatrick,https://www.amazon.com/s?k=The+Mom+Test+Rob+Fitzpatrick,https://www.amazon.com/s?k=The+Mom+Test+Rob+Fitzpatrick&tag=aurarevenue-20,Books,saas-founder-toolkit,Founders validating customer demand,Verify in Amazon Associates before publishing public claims,Verify in Amazon Associates before publishing public claims,Do not hardcode,Improves assumptions behind demand and conversion forecasts,Customer research rather than finance,Yes
The Startup Owner's Manual by Steve Blank and Bob Dorf,https://www.amazon.com/s?k=The+Startup+Owner%27s+Manual+Steve+Blank+Bob+Dorf,https://www.amazon.com/s?k=The+Startup+Owner%27s+Manual+Steve+Blank+Bob+Dorf&tag=aurarevenue-20,Books,research only,Founders studying customer development,Verify in Amazon Associates before publishing public claims,Verify in Amazon Associates before publishing public claims,Do not hardcode,Relevant to startup process and customer discovery,Large dense book may not convert well,No
Profit First by Mike Michalowicz,https://www.amazon.com/s?k=Profit+First+Mike+Michalowicz,https://www.amazon.com/s?k=Profit+First+Mike+Michalowicz&tag=aurarevenue-20,Books,research only,Small business cash discipline,Verify in Amazon Associates before publishing public claims,Verify in Amazon Associates before publishing public claims,Do not hardcode,Useful cash discipline theme,Not SaaS-specific and could imply advice if positioned poorly,No
Moleskine Classic Notebook,https://www.amazon.com/s?k=Moleskine+Classic+Notebook,https://www.amazon.com/s?k=Moleskine+Classic+Notebook&tag=aurarevenue-20,Planning tools,startup-planning-tools; saas-founder-toolkit,Founders who keep simple planning notes,Verify in Amazon Associates before publishing public claims,Verify in Amazon Associates before publishing public claims,Do not hardcode,Useful for decision logs assumptions and planning notes,Unstructured format,Yes
Leuchtturm1917 Medium A5 Notebook,https://www.amazon.com/s?k=Leuchtturm1917+Medium+A5+Notebook,https://www.amazon.com/s?k=Leuchtturm1917+Medium+A5+Notebook&tag=aurarevenue-20,Planning tools,startup-planning-tools,Founders using indexed notes,Verify in Amazon Associates before publishing public claims,Verify in Amazon Associates before publishing public claims,Do not hardcode,Numbered pages and index help decision tracking,Requires a note-taking routine,Yes
Rocketbook Core Reusable Smart Notebook,https://www.amazon.com/s?k=Rocketbook+Core+Reusable+Smart+Notebook,https://www.amazon.com/s?k=Rocketbook+Core+Reusable+Smart+Notebook&tag=aurarevenue-20,Planning tools,startup-planning-tools,Founders who want handwritten notes saved digitally,Verify in Amazon Associates before publishing public claims,Verify in Amazon Associates before publishing public claims,Do not hardcode,Useful for notes that move into digital archives,Requires compatible pens and workflow,Yes
Post-it Super Sticky Easel Pad,https://www.amazon.com/s?k=Post-it+Super+Sticky+Easel+Pad,https://www.amazon.com/s?k=Post-it+Super+Sticky+Easel+Pad&tag=aurarevenue-20,Planning tools,startup-planning-tools; saas-founder-toolkit,Workshop-style planning and quarterly reviews,Verify in Amazon Associates before publishing public claims,Verify in Amazon Associates before publishing public claims,Do not hardcode,Good for funnels cohorts and strategy mapping,Needs wall space,Yes
Quartet Glass Whiteboard,https://www.amazon.com/s?k=Quartet+Glass+Whiteboard,https://www.amazon.com/s?k=Quartet+Glass+Whiteboard&tag=aurarevenue-20,Planning tools,startup-planning-tools; founder-office-setup,Persistent KPI and forecast visibility,Verify in Amazon Associates before publishing public claims,Verify in Amazon Associates before publishing public claims,Do not hardcode,Keeps monthly targets and priorities visible,Requires mounting space,Yes
Casio MS-80B Desktop Calculator,https://www.amazon.com/s?k=Casio+MS-80B+Desktop+Calculator,https://www.amazon.com/s?k=Casio+MS-80B+Desktop+Calculator&tag=aurarevenue-20,Planning tools,startup-planning-tools,Quick desk math during planning sessions,Verify in Amazon Associates before publishing public claims,Verify in Amazon Associates before publishing public claims,Do not hardcode,Useful for quick percentage and MRR checks,Basic calculator only,Yes
HP 12C Financial Calculator,https://www.amazon.com/s?k=HP+12C+Financial+Calculator,https://www.amazon.com/s?k=HP+12C+Financial+Calculator&tag=aurarevenue-20,Planning tools,startup-planning-tools,Founders who want dedicated finance calculator,Verify in Amazon Associates before publishing public claims,Verify in Amazon Associates before publishing public claims,Do not hardcode,Long-running finance calculator option,Learning curve and overkill for many SaaS founders,Yes
Full Focus Planner,https://www.amazon.com/s?k=Full+Focus+Planner,https://www.amazon.com/s?k=Full+Focus+Planner&tag=aurarevenue-20,Planning tools,startup-planning-tools; saas-founder-toolkit,Founders who want structured quarterly goals,Verify in Amazon Associates before publishing public claims,Verify in Amazon Associates before publishing public claims,Do not hardcode,Supports quarterly priorities and execution reviews,Only useful with consistent review habit,Yes
Pilot FriXion Erasable Pens,https://www.amazon.com/s?k=Pilot+FriXion+Erasable+Pens,https://www.amazon.com/s?k=Pilot+FriXion+Erasable+Pens&tag=aurarevenue-20,Planning tools,startup-planning-tools,Reusable notebooks and editable planning notes,Verify in Amazon Associates before publishing public claims,Verify in Amazon Associates before publishing public claims,Do not hardcode,Useful for frequently changing assumptions,Ink behavior varies by paper and temperature,Yes
AT-A-GLANCE Wall Calendar,https://www.amazon.com/s?k=AT-A-GLANCE+Wall+Calendar,https://www.amazon.com/s?k=AT-A-GLANCE+Wall+Calendar&tag=aurarevenue-20,Planning tools,research only,Founders who plan launches visually,Verify in Amazon Associates before publishing public claims,Verify in Amazon Associates before publishing public claims,Do not hardcode,Could support launch and review cadence,Less directly tied to SaaS finance pages,No
Dell UltraSharp U2723QE 27-inch 4K Monitor,https://www.amazon.com/s?k=Dell+UltraSharp+U2723QE+27+inch+4K+Monitor,https://www.amazon.com/s?k=Dell+UltraSharp+U2723QE+27+inch+4K+Monitor&tag=aurarevenue-20,Office gear,founder-office-setup; saas-founder-toolkit,Founders working in dashboards and spreadsheets,Verify in Amazon Associates before publishing public claims,Verify in Amazon Associates before publishing public claims,Do not hardcode,Direct productivity fit for spreadsheets dashboards and docs,Premium price and desk space needed,Yes
LG UltraWide Monitor,https://www.amazon.com/s?k=LG+UltraWide+Monitor,https://www.amazon.com/s?k=LG+UltraWide+Monitor&tag=aurarevenue-20,Office gear,founder-office-setup,Founders who keep many work surfaces open,Verify in Amazon Associates before publishing public claims,Verify in Amazon Associates before publishing public claims,Do not hardcode,Supports side-by-side dashboards and planning docs,Some prefer dual monitors,Yes
Logitech MX Keys S Wireless Keyboard,https://www.amazon.com/s?k=Logitech+MX+Keys+S+Wireless+Keyboard,https://www.amazon.com/s?k=Logitech+MX+Keys+S+Wireless+Keyboard&tag=aurarevenue-20,Office gear,founder-office-setup; saas-founder-toolkit,Long writing spreadsheet and documentation sessions,Verify in Amazon Associates before publishing public claims,Verify in Amazon Associates before publishing public claims,Do not hardcode,Practical daily productivity upgrade,Keyboard feel is personal,Yes
Logitech MX Master 3S Wireless Mouse,https://www.amazon.com/s?k=Logitech+MX+Master+3S+Wireless+Mouse,https://www.amazon.com/s?k=Logitech+MX+Master+3S+Wireless+Mouse&tag=aurarevenue-20,Office gear,founder-office-setup; saas-founder-toolkit,Spreadsheet-heavy and multi-app workflows,Verify in Amazon Associates before publishing public claims,Verify in Amazon Associates before publishing public claims,Do not hardcode,Horizontal scrolling helps spreadsheet and dashboard work,Larger than compact mice,Yes
Rain Design mStand Laptop Stand,https://www.amazon.com/s?k=Rain+Design+mStand+Laptop+Stand,https://www.amazon.com/s?k=Rain+Design+mStand+Laptop+Stand&tag=aurarevenue-20,Office gear,founder-office-setup,Desk setups using external keyboard and monitor,Verify in Amazon Associates before publishing public claims,Verify in Amazon Associates before publishing public claims,Do not hardcode,Simple ergonomic laptop setup upgrade,Best with external keyboard and mouse,Yes
Roost Laptop Stand,https://www.amazon.com/s?k=Roost+Laptop+Stand,https://www.amazon.com/s?k=Roost+Laptop+Stand&tag=aurarevenue-20,Office gear,founder-office-setup,Portable ergonomic setups,Verify in Amazon Associates before publishing public claims,Verify in Amazon Associates before publishing public claims,Do not hardcode,Good for remote and travel work,More expensive than basic stands,Yes
Anker USB-C Hub,https://www.amazon.com/s?k=Anker+USB-C+Hub,https://www.amazon.com/s?k=Anker+USB-C+Hub&tag=aurarevenue-20,Office gear,founder-office-setup,Laptop workstations with monitors and accessories,Verify in Amazon Associates before publishing public claims,Verify in Amazon Associates before publishing public claims,Do not hardcode,Reduces friction connecting founder workstation gear,Compatibility must be checked,Yes
BenQ ScreenBar Monitor Light,https://www.amazon.com/s?k=BenQ+ScreenBar+Monitor+Light,https://www.amazon.com/s?k=BenQ+ScreenBar+Monitor+Light&tag=aurarevenue-20,Office gear,founder-office-setup,Evening work without harsh desk glare,Verify in Amazon Associates before publishing public claims,Verify in Amazon Associates before publishing public claims,Do not hardcode,Useful for long planning and writing sessions,Monitor and webcam fit must be checked,Yes
Logitech Brio 4K Webcam,https://www.amazon.com/s?k=Logitech+Brio+4K+Webcam,https://www.amazon.com/s?k=Logitech+Brio+4K+Webcam&tag=aurarevenue-20,Office gear,founder-office-setup; saas-founder-toolkit,Founder sales calls demos and investor meetings,Verify in Amazon Associates before publishing public claims,Verify in Amazon Associates before publishing public claims,Do not hardcode,Improves video quality for calls and demos,Lighting and internet still matter,Yes
Blue Yeti USB Microphone,https://www.amazon.com/s?k=Blue+Yeti+USB+Microphone,https://www.amazon.com/s?k=Blue+Yeti+USB+Microphone&tag=aurarevenue-20,Office gear,founder-office-setup,Calls webinars and recorded walkthroughs,Verify in Amazon Associates before publishing public claims,Verify in Amazon Associates before publishing public claims,Do not hardcode,Improves audio for demos and educational content,Can pick up room noise,Yes
Sony WH-1000XM5 Noise Canceling Headphones,https://www.amazon.com/s?k=Sony+WH-1000XM5+Noise+Canceling+Headphones,https://www.amazon.com/s?k=Sony+WH-1000XM5+Noise+Canceling+Headphones&tag=aurarevenue-20,Office gear,founder-office-setup; saas-founder-toolkit,Focused work and noisy environments,Verify in Amazon Associates before publishing public claims,Verify in Amazon Associates before publishing public claims,Do not hardcode,Supports deep work for modeling writing and product decisions,Premium purchase and fit varies,Yes
Elgato Key Light Air,https://www.amazon.com/s?k=Elgato+Key+Light+Air,https://www.amazon.com/s?k=Elgato+Key+Light+Air&tag=aurarevenue-20,Office gear,founder-office-setup,Consistent lighting for video calls,Verify in Amazon Associates before publishing public claims,Verify in Amazon Associates before publishing public claims,Do not hardcode,Improves founder call and demo appearance,Desk lamp may be enough for some users,Yes
Shure MV7 USB Microphone,https://www.amazon.com/s?k=Shure+MV7+USB+Microphone,https://www.amazon.com/s?k=Shure+MV7+USB+Microphone&tag=aurarevenue-20,Office gear,research only,Premium founder audio setup,Verify in Amazon Associates before publishing public claims,Verify in Amazon Associates before publishing public claims,Do not hardcode,Strong audio reputation for creators and webinars,Higher cost and may be overkill,No
Apple Magic Trackpad,https://www.amazon.com/s?k=Apple+Magic+Trackpad,https://www.amazon.com/s?k=Apple+Magic+Trackpad&tag=aurarevenue-20,Office gear,research only,Mac users who prefer gestures,Verify in Amazon Associates before publishing public claims,Verify in Amazon Associates before publishing public claims,Do not hardcode,Useful for Mac workflows,Too platform-specific for main page,No
Bose QuietComfort Headphones,https://www.amazon.com/s?k=Bose+QuietComfort+Headphones,https://www.amazon.com/s?k=Bose+QuietComfort+Headphones&tag=aurarevenue-20,Office gear,research only,Noise control alternative,Verify in Amazon Associates before publishing public claims,Verify in Amazon Associates before publishing public claims,Do not hardcode,Relevant alternative to Sony headphones,Duplicate category for current shortlist,No
